{
  "$schema": "../landing.schema.json",
  "pack": "construction_materials",
  "slug": "construction",
  "meta": {
    "title": {
      "en": "{brand} for construction material sellers: quotes, trips and dues on WhatsApp",
      "te": "నిర్మాణ సామగ్రి అమ్మకందారుల కోసం {brand}: వాట్సాప్‌లో కోట్లు, ట్రిప్పులు, బాకీలు",
      "hi": "निर्माण सामग्री बेचने वालों के लिए {brand}: व्हाट्सऐप पर कोटेशन, ट्रिप और बकाया",
      "kn": "ನಿರ್ಮಾಣ ಸಾಮಗ್ರಿ ಮಾರಾಟಗಾರರಿಗೆ {brand}: ವಾಟ್ಸಾಪ್‌ನಲ್ಲಿ ಕೊಟೇಶನ್, ಟ್ರಿಪ್, ಬಾಕಿ"
    },
    "description": {
      "en": "Turn 'how many blocks for 1,000 sq ft?' into a clear quote, plan the delivery trips and remind contractors about dues. Try the free paver calculator. You approve every price and promise.",
      "te": "'1,000 చదరపు అడుగులకు ఎన్ని బ్లాకులు?' అనే ప్రశ్నను స్పష్టమైన కోట్‌గా మార్చండి, డెలివరీ ట్రిప్పులు ప్లాన్ చేయండి, కాంట్రాక్టర్లకు బాకీ రిమైండర్ ఇవ్వండి. ఉచిత పేవర్ కాలిక్యులేటర్ ప్రయత్నించండి. ప్రతి ధర, ప్రామిస్ మీరే ఓకే చేస్తారు.",
      "hi": "'1,000 वर्ग फ़ुट के लिए कितने ब्लॉक?' को साफ़ कोटेशन में बदलें, डिलीवरी ट्रिप तय करें और कॉन्ट्रैक्टरों को बकाया की याद दिलाएँ। मुफ़्त पेवर कैलकुलेटर आज़माएँ। हर कीमत और वादा आप ही ओके करते हैं।",
      "kn": "'1,000 ಚದರ ಅಡಿಗೆ ಎಷ್ಟು ಬ್ಲಾಕ್?' ಅನ್ನು ಸ್ಪಷ್ಟ ಕೊಟೇಶನ್ ಮಾಡಿ, ಡೆಲಿವರಿ ಟ್ರಿಪ್ ಯೋಜಿಸಿ, ಕಾಂಟ್ರ್ಯಾಕ್ಟರ್‌ಗಳಿಗೆ ಬಾಕಿ ನೆನಪಿಸಿ. ಉಚಿತ ಪೇವರ್ ಕ್ಯಾಲ್ಕುಲೇಟರ್ ಪ್ರಯತ್ನಿಸಿ. ಪ್ರತಿ ಬೆಲೆ, ಮಾತನ್ನು ನೀವೇ ಒಪ್ಪುತ್ತೀರಿ."
    }
  },
  "hero": {
    "eyebrow": {
      "en": "For paver block, brick, tile, cement and sand sellers",
      "te": "పేవర్ బ్లాకులు, ఇటుకలు, టైల్స్, సిమెంట్, ఇసుక అమ్మకందారుల కోసం",
      "hi": "पेवर ब्लॉक, ईंट, टाइल, सीमेंट और रेत बेचने वालों के लिए",
      "kn": "ಪೇವರ್ ಬ್ಲಾಕ್, ಇಟ್ಟಿಗೆ, ಟೈಲ್, ಸಿಮೆಂಟ್, ಮರಳು ಮಾರಾಟಗಾರರಿಗಾಗಿ"
    },
    "h1": {
      "en": "From area to quote in minutes, on WhatsApp.",
      "te": "ఏరియా నుండి కోట్ వరకు నిమిషాల్లో, వాట్సాప్‌లో.",
      "hi": "एरिया से कोटेशन तक मिनटों में, व्हाट्सऐप पर।",
      "kn": "ಏರಿಯಾದಿಂದ ಕೊಟೇಶನ್‌ವರೆಗೆ ನಿಮಿಷಗಳಲ್ಲಿ, ವಾಟ್ಸಾಪ್‌ನಲ್ಲಿ."
    },
    "sub": {
      "en": "{brand} works out pieces, wastage and trips from the area, prepares the quote from your price list and reminds contractors about dues. You approve every price and promise.",
      "te": "{brand} ఏరియా నుండి ముక్కలు, వేస్టేజ్, ట్రిప్పులు లెక్కిస్తుంది, మీ ధరల జాబితా నుండి కోట్ తయారు చేస్తుంది, కాంట్రాక్టర్లకు బాకీ గుర్తు చేస్తుంది. ప్రతి ధర, ప్రామిస్ మీరే ఓకే చేస్తారు.",
      "hi": "{brand} एरिया से पीस, वेस्टेज और ट्रिप निकालता है, आपकी प्राइस लिस्ट से कोटेशन बनाता है और कॉन्ट्रैक्टरों को बकाया याद दिलाता है। हर कीमत और वादा आप ही ओके करते हैं।",
      "kn": "{brand} ಏರಿಯಾದಿಂದ ಪೀಸ್, ವೇಸ್ಟೇಜ್, ಟ್ರಿಪ್ ಲೆಕ್ಕ ಮಾಡುತ್ತದೆ, ನಿಮ್ಮ ಬೆಲೆ ಪಟ್ಟಿಯಿಂದ ಕೊಟೇಶನ್ ಮಾಡುತ್ತದೆ, ಕಾಂಟ್ರ್ಯಾಕ್ಟರ್‌ಗಳಿಗೆ ಬಾಕಿ ನೆನಪಿಸುತ್ತದೆ. ಪ್ರತಿ ಬೆಲೆ, ಮಾತನ್ನು ನೀವೇ ಒಪ್ಪುತ್ತೀರಿ."
    }
  },
  "home_card": {
    "title": {
      "en": "Paver block, brick, tile and cement sellers",
      "te": "పేవర్ బ్లాక్, ఇటుక, టైల్స్, సిమెంట్ అమ్మేవారు",
      "hi": "पेवर ब्लॉक, ईंट, टाइल और सीमेंट बेचने वाले",
      "kn": "ಪೇವರ್ ಬ್ಲಾಕ್, ಇಟ್ಟಿಗೆ, ಟೈಲ್ಸ್, ಸಿಮೆಂಟ್ ಮಾರುವವರು"
    },
    "line": {
      "en": "Area to pieces and trips, deliveries, contractor dues",
      "te": "ఏరియా నుంచి పీసులు, ట్రిప్పులు, డెలివరీలు, కాంట్రాక్టర్ బాకీలు",
      "hi": "एरिया से पीस और ट्रिप, डिलीवरी, ठेकेदार का बकाया",
      "kn": "ಏರಿಯಾದಿಂದ ಪೀಸ್ ಮತ್ತು ಟ್ರಿಪ್, ಡೆಲಿವರಿ, ಕಾಂಟ್ರಾಕ್ಟರ್ ಬಾಕಿ"
    },
    "link": {
      "en": "Try the paver calculator",
      "te": "పేవర్ కాలిక్యులేటర్ ట్రై చేయండి",
      "hi": "पेवर कैलकुलेटर आज़माएँ",
      "kn": "ಪೇವರ್ ಕ್ಯಾಲ್ಕುಲೇಟರ್ ಪ್ರಯತ್ನಿಸಿ"
    }
  },
  "problem": {
    "title": {
      "en": "Every enquiry needs maths, and every delivery needs a plan",
      "te": "ప్రతి ఎంక్వయిరీకి లెక్క, ప్రతి డెలివరీకి ప్లాన్ కావాలి",
      "hi": "हर पूछताछ में हिसाब लगता है, हर डिलीवरी में योजना",
      "kn": "ಪ್ರತಿ ವಿಚಾರಣೆಗೆ ಲೆಕ್ಕ, ಪ್ರತಿ ಡೆಲಿವರಿಗೆ ಯೋಜನೆ ಬೇಕು"
    },
    "points": [
      {
        "en": "Area to quantity, wastage and transport take time, so quotes go out late.",
        "te": "ఏరియా నుండి క్వాంటిటీ, వేస్టేజ్, ట్రాన్స్‌పోర్ట్ లెక్కలకు సమయం పడుతుంది, కోట్లు ఆలస్యంగా వెళ్తాయి.",
        "hi": "एरिया से मात्रा, वेस्टेज और ट्रांसपोर्ट के हिसाब में समय लगता है, इसलिए कोटेशन देर से जाते हैं।",
        "kn": "ಏರಿಯಾದಿಂದ ಕ್ವಾಂಟಿಟಿ, ವೇಸ್ಟೇಜ್, ಸಾಗಣೆ ಲೆಕ್ಕಕ್ಕೆ ಸಮಯ ಹಿಡಿಯುತ್ತದೆ, ಕೊಟೇಶನ್ ತಡವಾಗಿ ಹೋಗುತ್ತದೆ."
      },
      {
        "en": "Deliveries go in trips, and a missed trip means an angry site.",
        "te": "డెలివరీలు ట్రిప్పులుగా వెళ్తాయి, ఒక ట్రిప్ మిస్ అయితే సైట్ దగ్గర కోపం.",
        "hi": "डिलीवरी ट्रिप में जाती है, और एक ट्रिप छूटी तो साइट पर नाराज़गी।",
        "kn": "ಡೆಲಿವರಿ ಟ್ರಿಪ್‌ಗಳಲ್ಲಿ ಹೋಗುತ್ತದೆ, ಒಂದು ಟ್ರಿಪ್ ತಪ್ಪಿದರೆ ಸೈಟ್‌ನಲ್ಲಿ ಕೋಪ."
      },
      {
        "en": "Contractors pay late, and chasing them takes your evenings.",
        "te": "కాంట్రాక్టర్లు ఆలస్యంగా పేమెంట్ ఇస్తారు, వెంటపడటానికి మీ సాయంత్రాలు పోతాయి.",
        "hi": "कॉन्ट्रैक्टर देर से पेमेंट देते हैं, और उन्हें याद दिलाने में आपकी शामें जाती हैं।",
        "kn": "ಕಾಂಟ್ರ್ಯಾಕ್ಟರ್‌ಗಳು ತಡವಾಗಿ ಪೇಮೆಂಟ್ ಕೊಡುತ್ತಾರೆ, ಅವರ ಹಿಂದೆ ಬೀಳಲು ನಿಮ್ಮ ಸಂಜೆಗಳು ಹೋಗುತ್ತವೆ."
      }
    ]
  },
  "day": {
    "title": {
      "en": "A day with your AI team",
      "te": "మీ AI టీమ్‌తో ఒక రోజు",
      "hi": "आपकी AI टीम के साथ एक दिन",
      "kn": "ನಿಮ್ಮ AI ತಂಡದ ಜೊತೆ ಒಂದು ದಿನ"
    },
    "steps": [
      {
        "owl": "main",
        "time": "8:40",
        "text": {
          "en": "A contractor writes: a 1,000 sq ft driveway. Agent OWL asks for the thickness and the pattern.",
          "te": "ఒక కాంట్రాక్టర్ రాస్తారు: 1,000 చదరపు అడుగుల డ్రైవ్‌వే. Agent OWL మందం, ప్యాటర్న్ అడుగుతుంది.",
          "hi": "एक कॉन्ट्रैक्टर लिखता है: 1,000 वर्ग फ़ुट की ड्राइववे। Agent OWL मोटाई और पैटर्न पूछता है।",
          "kn": "ಒಬ್ಬ ಕಾಂಟ್ರ್ಯಾಕ್ಟರ್ ಬರೆಯುತ್ತಾರೆ: 1,000 ಚದರ ಅಡಿ ಡ್ರೈವ್‌ವೇ. Agent OWL ದಪ್ಪ, ಪ್ಯಾಟರ್ನ್ ಕೇಳುತ್ತದೆ."
        }
      },
      {
        "owl": "requirement_analyst",
        "time": "9:00",
        "text": {
          "en": "The Site Measurer works out pieces, wastage, pallets and trips.",
          "te": "సైట్ మెజరర్ ముక్కలు, వేస్టేజ్, ప్యాలెట్లు, ట్రిప్పులు లెక్కిస్తాడు.",
          "hi": "साइट मेज़रर पीस, वेस्टेज, पैलेट और ट्रिप निकालता है।",
          "kn": "ಸೈಟ್ ಮೆಜರರ್ ಪೀಸ್, ವೇಸ್ಟೇಜ್, ಪ್ಯಾಲೆಟ್, ಟ್ರಿಪ್ ಲೆಕ್ಕ ಮಾಡುತ್ತದೆ."
        }
      },
      {
        "owl": "quote_writer",
        "time": "9:20",
        "text": {
          "en": "A quote with transport is ready from your price list. It waits for your OK.",
          "te": "ట్రాన్స్‌పోర్ట్‌తో కోట్ మీ ధరల జాబితా నుండి సిద్ధం. మీ ఓకే కోసం ఆగుతుంది.",
          "hi": "ट्रांसपोर्ट के साथ कोटेशन आपकी प्राइस लिस्ट से तैयार है। वह आपके ओके का इंतज़ार करता है।",
          "kn": "ಸಾಗಣೆ ಸಹಿತ ಕೊಟೇಶನ್ ನಿಮ್ಮ ಬೆಲೆ ಪಟ್ಟಿಯಿಂದ ಸಿದ್ಧ. ನಿಮ್ಮ ಓಕೆಗಾಗಿ ಕಾಯುತ್ತದೆ."
        }
      },
      {
        "owl": "order_desk",
        "time": "2:00",
        "text": {
          "en": "The Dispatch Desk plans two trips for Thursday and shows the delivery note.",
          "te": "డిస్పాచ్ డెస్క్ గురువారానికి రెండు ట్రిప్పులు ప్లాన్ చేసి, డెలివరీ నోట్ చూపిస్తుంది.",
          "hi": "डिस्पैच डेस्क गुरुवार के लिए दो ट्रिप तय करता है और डिलीवरी नोट दिखाता है।",
          "kn": "ಡಿಸ್ಪ್ಯಾಚ್ ಡೆಸ್ಕ್ ಗುರುವಾರಕ್ಕೆ ಎರಡು ಟ್ರಿಪ್ ಯೋಜಿಸಿ, ಡೆಲಿವರಿ ನೋಟ್ ತೋರಿಸುತ್ತದೆ."
        }
      },
      {
        "owl": "followup_desk",
        "time": "5:30",
        "text": {
          "en": "The Follow-up Desk drafts a payment reminder for a contractor with a balance due.",
          "te": "ఫాలో-అప్ డెస్క్ బాకీ ఉన్న కాంట్రాక్టర్‌కి పేమెంట్ రిమైండర్ డ్రాఫ్ట్ చేస్తుంది.",
          "hi": "फ़ॉलो-अप डेस्क बकाया वाले कॉन्ट्रैक्टर के लिए पेमेंट रिमाइंडर का ड्राफ़्ट बनाता है।",
          "kn": "ಫಾಲೋ-ಅಪ್ ಡೆಸ್ಕ್ ಬಾಕಿ ಇರುವ ಕಾಂಟ್ರ್ಯಾಕ್ಟರ್‌ಗೆ ಪೇಮೆಂಟ್ ರಿಮೈಂಡರ್ ಡ್ರಾಫ್ಟ್ ಮಾಡುತ್ತದೆ."
        }
      }
    ]
  },
  "features": {
    "title": {
      "en": "What it does for a materials seller",
      "te": "నిర్మాణ సామగ్రి అమ్మకందారుకి ఇది చేసేది",
      "hi": "निर्माण सामग्री बेचने वाले के लिए यह क्या करता है",
      "kn": "ನಿರ್ಮಾಣ ಸಾಮಗ್ರಿ ಮಾರಾಟಗಾರರಿಗೆ ಇದು ಮಾಡುವುದು"
    },
    "items": [
      {
        "icon": "calculator",
        "title": {
          "en": "Area to quantity",
          "te": "ఏరియా నుండి క్వాంటిటీ",
          "hi": "एरिया से मात्रा",
          "kn": "ಏರಿಯಾದಿಂದ ಕ್ವಾಂಟಿಟಿ"
        },
        "body": {
          "en": "Pieces, wastage, pallets and trips from the area. The same rules as in the app.",
          "te": "ఏరియా నుండి ముక్కలు, వేస్టేజ్, ప్యాలెట్లు, ట్రిప్పులు. యాప్‌లోని నియమాలే.",
          "hi": "एरिया से पीस, वेस्टेज, पैलेट और ट्रिप। वही नियम जो ऐप में हैं।",
          "kn": "ಏರಿಯಾದಿಂದ ಪೀಸ್, ವೇಸ್ಟೇಜ್, ಪ್ಯಾಲೆಟ್, ಟ್ರಿಪ್. ಆ್ಯಪ್‌ನಲ್ಲಿರುವ ನಿಯಮಗಳೇ."
        }
      },
      {
        "icon": "file",
        "title": {
          "en": "Quotes with transport",
          "te": "ట్రాన్స్‌పోర్ట్‌తో కోట్లు",
          "hi": "ट्रांसपोर्ट के साथ कोटेशन",
          "kn": "ಸಾಗಣೆ ಸಹಿತ ಕೊಟೇಶನ್"
        },
        "body": {
          "en": "Material, transport and tax in one clear quote. The AI never sets a price.",
          "te": "మెటీరియల్, ట్రాన్స్‌పోర్ట్, పన్ను ఒకే స్పష్టమైన కోట్‌లో. AI ఎప్పుడూ ధర పెట్టదు.",
          "hi": "मटीरियल, ट्रांसपोर्ट और टैक्स एक साफ़ कोटेशन में। AI कभी कीमत तय नहीं करता।",
          "kn": "ಮೆಟೀರಿಯಲ್, ಸಾಗಣೆ, ತೆರಿಗೆ ಒಂದೇ ಸ್ಪಷ್ಟ ಕೊಟೇಶನ್‌ನಲ್ಲಿ. AI ಎಂದೂ ಬೆಲೆ ಹಾಕುವುದಿಲ್ಲ."
        }
      },
      {
        "icon": "truck",
        "title": {
          "en": "Deliveries in trips",
          "te": "ట్రిప్పులలో డెలివరీలు",
          "hi": "ट्रिप में डिलीवरी",
          "kn": "ಟ್ರಿಪ್‌ಗಳಲ್ಲಿ ಡೆಲಿವರಿ"
        },
        "body": {
          "en": "Plan the trips and keep a delivery note for each.",
          "te": "ట్రిప్పులు ప్లాన్ చేసి, ప్రతిదానికి డెలివరీ నోట్ ఉంచండి.",
          "hi": "ट्रिप तय करें और हर एक का डिलीवरी नोट रखें।",
          "kn": "ಟ್ರಿಪ್ ಯೋಜಿಸಿ, ಪ್ರತಿಯೊಂದಕ್ಕೂ ಡೆಲಿವರಿ ನೋಟ್ ಇಡಿ."
        }
      },
      {
        "icon": "wallet",
        "title": {
          "en": "Dues and reminders",
          "te": "బాకీలు, రిమైండర్లు",
          "hi": "बकाया और रिमाइंडर",